<?xml version="1.0" encoding="UTF-8"?>
<xs:schema xmlns:xs="http://www.w3.org/2001/XMLSchema">

    <xs:element name="Library">
        <xs:complexType>
            <xs:sequence>
                <xs:element name="Book" maxOccurs="unbounded">
                    <xs:complexType>
                        <xs:sequence>
                            <xs:element name="ID" type="xs:integer"/>
                            <xs:element name="Title" type="xs:string"/>
                            <xs:element name="Author" type="xs:string"/>
                            <xs:element name="PublicationYear">
                                <xs:simpleType>
                                    <xs:restriction base="xs:integer">
                                        <xs:minInclusive value="1800"/>
                                        <xs:maxInclusive value="2025"/>
                                    </xs:restriction>
                                </xs:simpleType>
                            </xs:element>
                            <xs:element name="Category">
                                <xs:simpleType>
                                    <xs:restriction base="xs:string">
                                        <xs:enumeration value="Văn học"/>
                                        <xs:enumeration value="Khoa học"/>
                                        <xs:enumeration value="Công nghệ"/>
                                        <xs:enumeration value="Lịch sử"/>
                                        <xs:enumeration value="Tâm lý học"/>
                                    </xs:restriction>
                                </xs:simpleType>
                            </xs:element>
                            <xs:element name="ISBN">
                                <xs:simpleType>
                                    <xs:restriction base="xs:string">
                                        <xs:length value="13"/>
                                    </xs:restriction>
                                </xs:simpleType>
                            </xs:element>
                            <xs:element name="Price">
                                <xs:simpleType>
                                    <xs:restriction base="xs:decimal">
                                        <xs:minExclusive value="0"/>
                                    </xs:restriction>
                                </xs:simpleType>
                            </xs:element>
                            <xs:element name="Available" type="xs:boolean"/>
                            <xs:element name="Website" type="xs:anyURI" minOccurs="0"/>
                            <xs:element name="Chapters">
                                <xs:complexType>
                                    <xs:sequence>
                                        <xs:element name="Chapter" maxOccurs="10" minOccurs="1">
                                            <xs:complexType>
                                                <xs:sequence>
                                                    <xs:element name="ChapterTitle" type="xs:string"/>
                                                    <xs:element name="ChapterNumber">
                                                        <xs:simpleType>
                                                            <xs:restriction base="xs:integer">
                                                                <xs:minInclusive value="1"/>
                                                                <xs:maxInclusive value="10"/>
                                                            </xs:restriction>
                                                        </xs:simpleType>
                                                    </xs:element>
                                                    <xs:element name="Pages">
                                                        <xs:simpleType>
                                                            <xs:restriction base="xs:integer">
                                                                <xs:minExclusive value="0"/>
                                                            </xs:restriction>
                                                        </xs:simpleType>
                                                    </xs:element>
                                                </xs:sequence>
                                            </xs:complexType>
                                        </xs:element>
                                    </xs:sequence>
                                </xs:complexType>
                            </xs:element>
                        </xs:sequence>
                    </xs:complexType>
                </xs:element>
            </xs:sequence>
        </xs:complexType>
    </xs:element>

</xs:schema>
